{
  "object_id": "obj_demo_embryo",
  "object_type": "pgo_embryo_sample",
  "schema_version": "1.0.0",
  "revision": 1,
  "created_at": "2026-09-16T12:20:00Z",
  "created_by": "platform_demo_import",
  "input_refs": [],
  "data": {
    "subject_id": "subject_demo_001",
    "order_ref": {
      "object_id": "obj_demo_order",
      "revision": 1
    },
    "sample_label": "DEMO-EMBRYO-BIOPSY-001",
    "state": "available_at_origin",
    "collected_at": "2026-09-16T12:20:00Z",
    "collected_by": "pgp_precision_lab",
    "current_location": {
      "location_id": "location_demo_origin",
      "name": "Demo collection site",
      "country_code": "AR"
    },
    "custodian_id": "pgp_precision_lab",
    "quantity": {
      "value": 1,
      "unit": "container"
    },
    "handling_profile": "handling_demo_embryo_biopsy_v1",
    "lineage_refs": [
      {
        "object_id": "obj_demo_whole_embryo",
        "revision": 1
      }
    ],
    "material_kind": "embryo_biopsy",
    "embryo_identifier": "EMBRYO-DEMO-001",
    "source_embryo_ref": {
      "object_id": "obj_demo_whole_embryo",
      "revision": 1
    }
  },
  "files": []
}
